Staff Member ID,Project Title,Stream
1,Dagon Dagon research worship ,DS
1,Miskatonic research Miskatonic Dagon ,DS
1,stories app mayhem Cthulhu app ,DS
2,Miskatonic worship stories worship Cthulhu app society ,CS
2,Miskatonic stories ,CS+DS
2,Miskatonic society society Dagon Miskatonic app myths ,CS
3,app mayhem ,CS+DS
3,stories stories Miskatonic society ,CS
3,mayhem myths ,CS+DS
4,Dagon ,CS
4,Dagon mayhem ,CS
4,research Dagon worship society Cthulhu stories ,CS+DS
5,myths worship Dagon society Dagon app Dagon ,CS
5,society mayhem ,CS+DS
5,app Cthulhu Cthulhu worship Cthulhu ,CS
6,app Miskatonic myths ,CS+DS
6,app Miskatonic Cthulhu worship mayhem ,CS
6,myths ,CS+DS
7,Miskatonic society worship myths myths ,CS+DS
7,Dagon research Dagon Dagon Miskatonic Cthulhu ,CS+DS
7,Dagon mayhem app ,CS
8,research Cthulhu worship ,CS+DS
8,Dagon Miskatonic Miskatonic app Miskatonic research Miskatonic ,CS+DS
8,Miskatonic stories Miskatonic Dagon society app myths ,CS
9,stories ,CS+DS
9,research ,CS+DS
9,society Miskatonic ,CS+DS
10,worship worship Cthulhu mayhem app ,CS
10,Dagon worship Cthulhu ,CS
10,myths stories ,CS
11,Miskatonic research app Cthulhu research ,DS
11,research Miskatonic mayhem research app Miskatonic research ,DS
11,Dagon myths stories Cthulhu ,DS
12,Cthulhu society mayhem research research mayhem mayhem stories ,CS
12,stories Dagon ,CS
12,stories worship society mayhem research worship Miskatonic ,CS+DS
13,app society Miskatonic Dagon society Miskatonic ,CS
13,Cthulhu app society society mayhem mayhem mayhem ,CS
13,Dagon research app stories ,CS+DS
14,worship worship Cthulhu society myths Miskatonic app ,CS
14,Dagon mayhem society stories ,CS+DS
14,worship society society worship research worship research myths ,CS
15,stories Miskatonic Miskatonic worship app ,DS
15,society ,DS
15,app ,DS
16,app ,CS
16,mayhem Miskatonic mayhem research society research Cthulhu ,CS+DS
16,Miskatonic app Miskatonic myths society Dagon ,CS
17,app mayhem mayhem worship Dagon app Miskatonic myths ,CS
17,Miskatonic myths ,CS
17,myths Cthulhu worship mayhem worship ,CS+DS
18,worship Cthulhu Dagon stories research ,CS
18,mayhem app stories Cthulhu ,CS
18,society mayhem worship ,CS+DS
19,Cthulhu Cthulhu mayhem stories Cthulhu stories mayhem Dagon ,CS+DS
19,research app stories society myths Dagon ,CS
19,myths society society ,CS+DS
20,Miskatonic Miskatonic Dagon worship myths myths mayhem myths ,DS
20,stories stories app Dagon research mayhem worship ,DS
20,Miskatonic worship Miskatonic society ,DS
21,app myths app worship society mayhem stories ,CS+DS
21,research society society worship Dagon worship ,CS
21,mayhem myths research worship stories society ,CS+DS
22,mayhem Miskatonic mayhem Miskatonic Miskatonic worship app ,CS+DS
22,Miskatonic research myths research Dagon mayhem Cthulhu ,CS
22,research myths ,CS+DS
23,worship Cthulhu stories research Miskatonic Miskatonic society app ,DS
23,myths society research ,DS
23,Miskatonic myths myths mayhem ,DS
24,stories society research ,DS
24,Dagon app mayhem society worship Cthulhu ,DS
24,Miskatonic app ,DS
25,app Cthulhu myths Miskatonic ,CS
25,worship stories research Cthulhu society ,CS+DS
25,app research stories society society Miskatonic ,CS
26,stories Miskatonic myths myths ,CS
26,Cthulhu worship ,CS+DS
26,Miskatonic ,CS
27,society app society Miskatonic ,CS
27,myths Cthulhu Dagon society Dagon worship society myths ,CS
27,Miskatonic society Miskatonic mayhem ,CS+DS
28,Dagon stories Dagon stories app ,CS
28,Dagon worship Cthulhu Miskatonic worship mayhem ,CS+DS
28,Dagon myths stories research Miskatonic Dagon Cthulhu worship ,CS+DS
29,worship Dagon myths Cthulhu app mayhem ,CS
29,worship Cthulhu research worship Miskatonic app research ,CS
29,app myths research stories app mayhem mayhem stories ,CS+DS
30,Dagon Dagon app society ,CS+DS
30,stories Miskatonic Dagon myths Miskatonic Cthulhu mayhem ,CS+DS
30,Dagon app Dagon mayhem society stories Cthulhu worship ,CS+DS
