Staff Member ID,Project Title,Stream
1,worship app Cthulhu Dagon Cthulhu ,CS
1,research worship app society mayhem research stories Dagon ,CS
1,stories research ,CS+DS
2,Cthulhu ,CS+DS
2,stories Dagon ,CS+DS
2,worship myths ,CS+DS
3,Miskatonic stories worship Dagon Miskatonic ,DS
3,app Cthulhu Dagon Cthulhu app Miskatonic ,DS
3,Cthulhu research app app ,DS
4,myths Dagon society Cthulhu stories mayhem app Miskatonic ,DS
4,research stories Dagon app myths Cthulhu worship society ,DS
4,myths stories society mayhem worship myths society myths ,DS
5,Miskatonic ,DS
5,mayhem ,DS
5,society Miskatonic myths Miskatonic stories research Miskatonic Cthulhu ,DS
6,stories society mayhem ,CS+DS
6,Miskatonic Dagon Miskatonic stories stories research mayhem ,CS
6,Miskatonic ,CS
7,worship stories ,DS
7,Cthulhu mayhem Cthulhu myths ,DS
7,myths society research myths Cthulhu Miskatonic ,DS
8,Dagon Miskatonic research app society worship stories ,CS+DS
8,worship worship Dagon ,CS+DS
8,myths mayhem Dagon myths stories society worship Dagon ,CS+DS
9,research research Miskatonic Dagon mayhem mayhem society ,DS
9,Miskatonic Dagon myths Miskatonic worship app society worship ,DS
9,stories worship stories Cthulhu society myths Cthulhu ,DS
10,Dagon Cthulhu ,CS
10,myths myths stories Cthulhu society ,CS+DS
10,worship Miskatonic mayhem ,CS
11,society myths stories research ,DS
11,society research society Cthulhu society ,DS
11,myths Miskatonic ,DS
12,Cthulhu Miskatonic mayhem myths worship society ,CS
12,Miskatonic stories Cthulhu stories mayhem worship research ,CS+DS
12,myths research mayhem Cthulhu app ,CS+DS
13,app Miskatonic Dagon society mayhem stories worship ,CS+DS
13,app Cthulhu ,CS
13,stories app worship mayhem society Cthulhu myths research ,CS+DS
14,mayhem app ,DS
14,myths myths Cthulhu Cthulhu ,DS
14,research Dagon mayhem ,DS
15,Cthulhu Miskatonic mayhem Miskatonic myths Cthulhu stories ,DS
15,stories stories app research ,DS
15,mayhem ,DS
16,Miskatonic stories stories ,CS
16,myths stories ,CS+DS
16,myths worship research ,CS+DS
17,Cthulhu Dagon Miskatonic stories myths ,CS
17,Dagon Dagon Cthulhu research ,CS+DS
17,Dagon myths society ,CS+DS
18,research Dagon research stories Miskatonic Cthulhu Miskatonic ,CS
18,myths research society research worship society myths ,CS+DS
18,myths worship research society mayhem ,CS
19,Cthulhu Cthulhu stories mayhem Miskatonic ,DS
19,Dagon society worship stories ,DS
19,Dagon mayhem society ,DS
20,society ,CS+DS
20,Dagon myths myths myths research Cthulhu ,CS+DS
20,research app mayhem app society Cthulhu society ,CS+DS
21,app worship worship worship Dagon ,DS
21,research Dagon ,DS
21,stories Miskatonic stories worship Miskatonic ,DS
22,research stories research Cthulhu mayhem stories worship ,CS
22,Miskatonic Dagon research ,CS
22,stories app ,CS
23,Miskatonic research research mayhem Miskatonic Miskatonic ,DS
23,mayhem society Dagon myths myths worship worship stories ,DS
23,myths myths research ,DS
24,society research Dagon Dagon ,DS
24,society society ,DS
24,worship society research research app myths app ,DS
25,stories ,CS
25,myths worship worship society Dagon Dagon ,CS
25,society research Cthulhu app ,CS+DS
26,mayhem society Dagon Dagon Miskatonic worship ,CS
26,society myths Miskatonic stories Dagon ,CS+DS
26,stories Cthulhu stories worship app stories ,CS
27,myths app Dagon worship Dagon ,CS
27,Miskatonic myths app society stories Miskatonic app ,CS+DS
27,research Dagon mayhem myths app ,CS
28,myths app society app Dagon Cthulhu Miskatonic ,DS
28,Dagon Miskatonic Dagon worship worship ,DS
28,Miskatonic research app worship worship worship app stories ,DS
29,society ,DS
29,stories stories Miskatonic society Dagon Miskatonic ,DS
29,Miskatonic ,DS
30,Cthulhu worship stories Cthulhu app worship research ,DS
30,Miskatonic myths mayhem Dagon ,DS
30,stories app mayhem app society ,DS
